{
  "$schema":"https://json-schema.org/draft/2020-12/schema",
  "$id":"https://riemann-lab.org/schemas/submission.v1.schema.json",
  "type":"object","additionalProperties":false,
  "required":["schema","labId","primaryLaneId","secondaryLaneIds","submissionKind","title","claim","assumptions","dependencies","evidence","doesNotEstablish","nearestFailureMode","killConditions","provenance","novelty"],
  "properties":{
    "schema":{"const":"riemann-lab.submission.v1"},"labId":{"const":"riemann-lab"},"primaryLaneId":{"type":"string","minLength":1},"secondaryLaneIds":{"type":"array","items":{"type":"string"},"uniqueItems":true},
    "submissionKind":{"enum":["theorem_candidate","formal_proof","proof_gap","counterexample","computational_certificate","literature_map","obstruction","tool_route","lane_proposal"]},"title":{"type":"string","minLength":3,"maxLength":180},
    "claim":{"type":"object","additionalProperties":false,"required":["plainStatement","domain","quantifiers","strongestSupportedConclusion","requestedClaimLevel"],"properties":{"plainStatement":{"type":"string","minLength":1},"formalStatement":{"type":"object","additionalProperties":false,"required":["proofSystem","declaration","trustedStatementPath","statementSha256"],"properties":{"proofSystem":{"type":"string"},"declaration":{"type":"string"},"trustedStatementPath":{"type":"string"},"statementSha256":{"type":"string","pattern":"^[a-f0-9]{64}$"}}},"domain":{"type":"string","minLength":1},"quantifiers":{"type":"array","items":{"type":"string"}},"strongestSupportedConclusion":{"type":"string","minLength":1},"requestedClaimLevel":{"enum":["proposal","source_backed","checked_artifact","internal_theorem"]}}},
    "assumptions":{"type":"array","items":{"type":"object","additionalProperties":false,"required":["id","text","status"],"properties":{"id":{"type":"string"},"text":{"type":"string"},"status":{"enum":["proved","imported","conjectural","computational"]}}}},"dependencies":{"type":"array","items":{"type":"string"}},
    "evidence":{"type":"object","additionalProperties":false,"required":["citations","artifacts"],"properties":{"citations":{"type":"array","items":{"type":"string"}},"artifacts":{"type":"array","items":{"type":"object","additionalProperties":false,"required":["artifactId","kind","sha256","sourceRevision"],"properties":{"artifactId":{"type":"string"},"kind":{"type":"string"},"sha256":{"type":"string","pattern":"^[a-f0-9]{64}$"},"sourceRevision":{"type":"string"}}}},"reproductionProtocolId":{"type":"string"}}},
    "doesNotEstablish":{"type":"array","minItems":1,"items":{"type":"string"}},"nearestFailureMode":{"type":"string","minLength":1},"killConditions":{"type":"array","items":{"type":"string"}},
    "provenance":{"type":"object","additionalProperties":false,"required":["contributors","models","sourceRepository","sourceRevision"],"properties":{"contributors":{"type":"array","items":{"type":"string"}},"models":{"type":"array","items":{"type":"string"}},"sourceRepository":{"type":"string"},"sourceRevision":{"type":"string"}}},"novelty":{"type":"object","additionalProperties":false,"required":["claim","searchRecord"],"properties":{"claim":{"enum":["none","unknown","candidate"]},"searchRecord":{"type":"array","items":{"type":"string"}}}}
  }
}
