{"schema":"riemann-lab.submission.v1","labId":"riemann-lab","primaryLaneId":"explicit-formula-zero-density","secondaryLaneIds":["formal-foundations"],"submissionKind":"literature_map","title":"Zeta23 statement map","claim":{"plainStatement":"Map the formal theorem statements in the Zeta23 artifact to public sources.","domain":"The cited Lean artifact and its stated theorems.","quantifiers":[],"strongestSupportedConclusion":"A source-backed map of a neighboring result.","requestedClaimLevel":"source_backed"},"assumptions":[],"dependencies":[],"evidence":{"citations":["https://arxiv.org/abs/2608.13637"],"artifacts":[{"artifactId":"zeta23-readme","kind":"source-map","sha256":"aaaaaaaaaaaaaaaaaaaaaaaaaaaaaaaaaaaaaaaaaaaaaaaaaaaaaaaaaaaaaaaa","sourceRevision":"main"}]},"doesNotEstablish":["The Riemann Hypothesis.","External acceptance of any new theorem."],"nearestFailureMode":"The mapping may omit a qualifier from the cited source.","killConditions":["A source mismatch is found."],"provenance":{"contributors":[],"models":[],"sourceRepository":"https://github.com/anthropics/zeta-23-lean","sourceRevision":"main"},"novelty":{"claim":"none","searchRecord":["known-work:zeta-23"]}}
